{
  "slug": "butterfly",
  "series": "best",
  "name": "butterfly",
  "artist": "smile. dk",
  "bpm": 135,
  "charts": [
    {
      "playStyle": "SINGLE",
      "difficulty": 0,
      "level": 1
    },
    {
      "playStyle": "SINGLE",
      "difficulty": 1,
      "level": 3
    },
    {
      "playStyle": "SINGLE",
      "difficulty": 2,
      "level": 4
    },
    {
      "playStyle": "SINGLE",
      "difficulty": 3,
      "level": 5
    },
    {
      "playStyle": "DOUBLE",
      "difficulty": 1,
      "level": 4
    },
    {
      "playStyle": "DOUBLE",
      "difficulty": 2,
      "level": 5
    },
    {
      "playStyle": "DOUBLE",
      "difficulty": 3,
      "level": 6
    },
    {
      "playStyle": "UNISON",
      "difficulty": 1,
      "level": 3
    },
    {
      "playStyle": "UNISON",
      "difficulty": 2,
      "level": 4
    },
    {
      "playStyle": "UNISON",
      "difficulty": 3,
      "level": 5
    }
  ]
}
