{
  "slug": "gentle-stress-amd",
  "series": "3rd",
  "name": "gentle stress (AMD SEXUAL MIX)",
  "artist": "MR. DOG feat. DJ SWAN",
  "bpm": 160,
  "charts": [
    {
      "playStyle": "SINGLE",
      "difficulty": 1,
      "level": 5
    },
    {
      "playStyle": "SINGLE",
      "difficulty": 2,
      "level": 7
    },
    {
      "playStyle": "SINGLE",
      "difficulty": 3,
      "level": 8
    },
    {
      "playStyle": "DOUBLE",
      "difficulty": 1,
      "level": 5
    },
    {
      "playStyle": "DOUBLE",
      "difficulty": 2,
      "level": 7
    },
    {
      "playStyle": "DOUBLE",
      "difficulty": 3,
      "level": 9
    },
    {
      "playStyle": "UNISON",
      "difficulty": 1,
      "level": 5
    },
    {
      "playStyle": "UNISON",
      "difficulty": 2,
      "level": 7
    },
    {
      "playStyle": "UNISON",
      "difficulty": 3,
      "level": 8
    }
  ]
}
