{
  "slug": "maximum-overdrive",
  "series": "max2-jp",
  "name": "MAXIMUM OVERDRIVE (KC Club Mix)",
  "artist": "2 UNLIMITED",
  "bpm": 140,
  "charts": [
    { "playStyle": "SINGLE", "difficulty": 1, "level": 2 },
    { "playStyle": "SINGLE", "difficulty": 2, "level": 4 },
    { "playStyle": "SINGLE", "difficulty": 3, "level": 8 },
    { "playStyle": "DOUBLE", "difficulty": 1, "level": 1 },
    { "playStyle": "DOUBLE", "difficulty": 2, "level": 5 },
    { "playStyle": "DOUBLE", "difficulty": 3, "level": 8 }
  ]
}
