{
  "slug": "sexy-planet",
  "series": "ext2",
  "name": "SEXY PLANET",
  "artist": "Crystal Aliens",
  "bpm": 180,
  "charts": [
    { "playStyle": "SINGLE", "difficulty": 0, "level": 2 },
    { "playStyle": "SINGLE", "difficulty": 1, "level": 5 },
    { "playStyle": "SINGLE", "difficulty": 2, "level": 6 },
    { "playStyle": "SINGLE", "difficulty": 3, "level": 7 },
    { "playStyle": "DOUBLE", "difficulty": 1, "level": 4 },
    { "playStyle": "DOUBLE", "difficulty": 2, "level": 5 },
    { "playStyle": "DOUBLE", "difficulty": 3, "level": 7 }
  ]
}
