{
  "slug": "make-it-better-so-real",
  "series": "konamix",
  "name": "MAKE IT BETTER (So-REAL MIX)",
  "artist": "mitsu-O! SUMMER",
  "bpm": 118,
  "charts": [
    { "playStyle": "SINGLE", "difficulty": 1, "level": 5 },
    { "playStyle": "SINGLE", "difficulty": 2, "level": 6 },
    { "playStyle": "SINGLE", "difficulty": 3, "level": 8 },
    { "playStyle": "DOUBLE", "difficulty": 1, "level": 5 },
    { "playStyle": "DOUBLE", "difficulty": 2, "level": 7 },
    { "playStyle": "DOUBLE", "difficulty": 3, "level": 8 },
    { "playStyle": "6-PANELS", "difficulty": 1, "level": 5 },
    { "playStyle": "6-PANELS", "difficulty": 2, "level": 6 },
    { "playStyle": "6-PANELS", "difficulty": 3, "level": 8 },
    { "playStyle": "BATTLE", "difficulty": 1, "level": 5 }
  ]
}
