{
  "slug": "groove-2001",
  "series": "extra",
  "name": "GROOVE 2001",
  "artist": "Sho-T feat. Blenda",
  "bpm": 140,
  "charts": [
    { "playStyle": "SINGLE", "difficulty": 1, "level": 4 },
    { "playStyle": "SINGLE", "difficulty": 2, "level": 6 },
    { "playStyle": "SINGLE", "difficulty": 3, "level": 7 },
    { "playStyle": "DOUBLE", "difficulty": 1, "level": 4 },
    { "playStyle": "DOUBLE", "difficulty": 2, "level": 6 },
    { "playStyle": "DOUBLE", "difficulty": 3, "level": 7 },
    { "playStyle": "6-PANELS", "difficulty": 1, "level": 4 },
    { "playStyle": "6-PANELS", "difficulty": 2, "level": 6 },
    { "playStyle": "6-PANELS", "difficulty": 3, "level": 7 }
  ]
}
