{
  "slug": "make-a-jam",
  "series": "konamix",
  "name": "MAKE A JAM!",
  "artist": "U1",
  "bpm": 124,
  "charts": [
    { "playStyle": "SINGLE", "difficulty": 1, "level": 3 },
    { "playStyle": "SINGLE", "difficulty": 2, "level": 5 },
    { "playStyle": "SINGLE", "difficulty": 3, "level": 7 },
    { "playStyle": "DOUBLE", "difficulty": 1, "level": 4 },
    { "playStyle": "DOUBLE", "difficulty": 2, "level": 5 },
    { "playStyle": "DOUBLE", "difficulty": 3, "level": 8 },
    { "playStyle": "6-PANELS", "difficulty": 1, "level": 3 },
    { "playStyle": "6-PANELS", "difficulty": 2, "level": 6 },
    { "playStyle": "6-PANELS", "difficulty": 3, "level": 7 }
  ]
}
