{
  "slug": "oha-oha-starter",
  "series": "oha-gb",
  "name": "OHA OHA スターター",
  "artist": "やまちゃん&レイモンド",
  "bpm": 144,
  "charts": [
    {
      "playStyle": "SINGLE",
      "difficulty": 1,
      "level": 4
    },
    {
      "playStyle": "SINGLE",
      "difficulty": 2,
      "level": 5
    },
    {
      "playStyle": "SINGLE",
      "difficulty": 3,
      "level": 6
    }
  ]
}
