{
  "slug": "max-300",
  "series": "max-jp",
  "name": "MAX 300",
  "artist": "Î©",
  "bpm": 300,
  "charts": [
    {
      "playStyle": "SINGLE",
      "difficulty": 1,
      "level": "?"
    },
    {
      "playStyle": "SINGLE",
      "difficulty": 2,
      "level": "?"
    },
    {
      "playStyle": "SINGLE",
      "difficulty": 3,
      "level": "?"
    },
    {
      "playStyle": "DOUBLE",
      "difficulty": 1,
      "level": "?"
    },
    {
      "playStyle": "DOUBLE",
      "difficulty": 2,
      "level": "?"
    },
    {
      "playStyle": "DOUBLE",
      "difficulty": 3,
      "level": "?"
    }
  ]
}
