{
  "slug": "peace-dct",
  "series": "dct",
  "name": "PEACE!",
  "artist": "DREAMS COME TRUE",
  "bpm": 161,
  "charts": [
    {
      "playStyle": "SINGLE",
      "difficulty": 1,
      "level": 3
    },
    {
      "playStyle": "SINGLE",
      "difficulty": 2,
      "level": 4.5
    },
    {
      "playStyle": "SINGLE",
      "difficulty": 3,
      "level": 6.5
    },
    {
      "playStyle": "SINGLE",
      "difficulty": 4,
      "level": "?"
    },
    {
      "playStyle": "DOUBLE",
      "difficulty": 1,
      "level": 2.5
    },
    {
      "playStyle": "DOUBLE",
      "difficulty": 2,
      "level": 8
    },
    {
      "playStyle": "DOUBLE",
      "difficulty": 3,
      "level": "?"
    },
    {
      "playStyle": "COUPLE",
      "difficulty": 1,
      "level": 3
    },
    {
      "playStyle": "COUPLE",
      "difficulty": 2,
      "level": 4.5
    },
    {
      "playStyle": "COUPLE",
      "difficulty": 3,
      "level": 6.5
    }
  ]
}
