{
  "slug": "look-at-us",
  "series": "ext2",
  "name": "LOOK AT US (Daddy DJ Remix)",
  "artist": "SARINA PARIS",
  "bpm": 135,
  "charts": [
    { "playStyle": "SINGLE", "difficulty": 0, "level": 1 },
    { "playStyle": "SINGLE", "difficulty": 1, "level": 2 },
    { "playStyle": "SINGLE", "difficulty": 2, "level": 6 },
    { "playStyle": "SINGLE", "difficulty": 3, "level": 7 },
    { "playStyle": "DOUBLE", "difficulty": 1, "level": 2 },
    { "playStyle": "DOUBLE", "difficulty": 2, "level": 5 },
    { "playStyle": "DOUBLE", "difficulty": 3, "level": 7 }
  ]
}
