{
  "slug": "la-bamba",
  "series": "ext2",
  "name": "LA BAMBA",
  "artist": "Mexican Folk Song",
  "bpm": 179,
  "charts": [
    { "playStyle": "SINGLE", "difficulty": 0, "level": 1 },
    { "playStyle": "SINGLE", "difficulty": 1, "level": 3 },
    { "playStyle": "SINGLE", "difficulty": 2, "level": 5 },
    { "playStyle": "SINGLE", "difficulty": 3, "level": 8 },
    { "playStyle": "DOUBLE", "difficulty": 1, "level": 4 },
    { "playStyle": "DOUBLE", "difficulty": 2, "level": 5 },
    { "playStyle": "DOUBLE", "difficulty": 3, "level": 8 }
  ]
}
