{
  "slug": "brilliant-2u-orchestra-groove",
  "series": "3rd",
  "name": "BRILLIANT 2U (Orchestra-Groove)",
  "artist": "NAOKI",
  "bpm": 150,
  "charts": [
    {
      "playStyle": "SINGLE",
      "difficulty": 1,
      "level": 5
    },
    {
      "playStyle": "SINGLE",
      "difficulty": 2,
      "level": 6
    },
    {
      "playStyle": "SINGLE",
      "difficulty": 3,
      "level": 7
    },
    {
      "playStyle": "DOUBLE",
      "difficulty": 1,
      "level": 4
    },
    {
      "playStyle": "DOUBLE",
      "difficulty": 2,
      "level": 5
    },
    {
      "playStyle": "UNISON",
      "difficulty": 1,
      "level": 5
    },
    {
      "playStyle": "UNISON",
      "difficulty": 2,
      "level": 6
    },
    {
      "playStyle": "UNISON",
      "difficulty": 3,
      "level": 7
    }
  ]
}
