{
  "slug": "in-my-eyes-midihead",
  "series": "strike",
  "name": "In My Eyes (Midihead Remix)",
  "artist": "Midihead",
  "bpm": 142,
  "charts": [
    { "playStyle": "SINGLE", "difficulty": 0, "level": 1 },
    { "playStyle": "SINGLE", "difficulty": 1, "level": 4 },
    { "playStyle": "SINGLE", "difficulty": 2, "level": 6 },
    { "playStyle": "SINGLE", "difficulty": 3, "level": 9 },
    { "playStyle": "DOUBLE", "difficulty": 1, "level": 4 },
    { "playStyle": "DOUBLE", "difficulty": 2, "level": 7 },
    { "playStyle": "DOUBLE", "difficulty": 3, "level": 9 }
  ]
}
