{
  "slug": "1-2-3-4-007-hard",
  "series": "gb3",
  "name": "1,2,3,4,007 (HARD)",
  "artist": "NI-NI",
  "bpm": 140,
  "charts": [
    {
      "playStyle": "SINGLE",
      "difficulty": 1,
      "level": 4
    },
    {
      "playStyle": "SINGLE",
      "difficulty": 2,
      "level": 6
    },
    {
      "playStyle": "SINGLE",
      "difficulty": 3,
      "level": 8
    }
  ]
}
