{
  "slug": "yozora-no-muko",
  "series": "max-jp",
  "name": "夜空ノムコウ",
  "artist": "EUROBEAT LOVERS",
  "bpm": 156,
  "charts": [
    {
      "playStyle": "SINGLE",
      "difficulty": 1,
      "level": "?"
    },
    {
      "playStyle": "SINGLE",
      "difficulty": 2,
      "level": "?"
    },
    {
      "playStyle": "SINGLE",
      "difficulty": 3,
      "level": "?"
    },
    {
      "playStyle": "DOUBLE",
      "difficulty": 1,
      "level": "?"
    },
    {
      "playStyle": "DOUBLE",
      "difficulty": 2,
      "level": "?"
    },
    {
      "playStyle": "DOUBLE",
      "difficulty": 3,
      "level": "?"
    }
  ]
}
