{
  "slug": "pure-mind",
  "series": "tkd",
  "name": "PURE MIND",
  "artist": "TRUE KiSS DESTiNATiON",
  "bpm": 120,
  "charts": [
    {
      "playStyle": "SINGLE",
      "difficulty": 1,
      "level": 3
    },
    {
      "playStyle": "SINGLE",
      "difficulty": 2,
      "level": 4
    },
    {
      "playStyle": "SINGLE",
      "difficulty": 3,
      "level": 6
    },
    {
      "playStyle": "SINGLE",
      "difficulty": 4,
      "level": "?"
    },
    {
      "playStyle": "SINGLE",
      "difficulty": 0,
      "level": "?"
    },
    {
      "playStyle": "DOUBLE",
      "difficulty": 1,
      "level": 4
    },
    {
      "playStyle": "DOUBLE",
      "difficulty": 2,
      "level": 7.5
    },
    {
      "playStyle": "DOUBLE",
      "difficulty": 3,
      "level": "?"
    },
    {
      "playStyle": "DOUBLE",
      "difficulty": 0,
      "level": "?"
    },
    {
      "playStyle": "COUPLE",
      "difficulty": 1,
      "level": 3
    },
    {
      "playStyle": "COUPLE",
      "difficulty": 2,
      "level": 4
    },
    {
      "playStyle": "COUPLE",
      "difficulty": 3,
      "level": 6
    }
  ]
}
