{
  "slug": "i-need-you",
  "series": "max2-us",
  "name": "I Need You",
  "artist": "Supa Fova feat. Jenny F.",
  "bpm": 114,
  "charts": [
    { "playStyle": "SINGLE", "difficulty": 0, "level": 1 },
    { "playStyle": "SINGLE", "difficulty": 1, "level": 3 },
    { "playStyle": "SINGLE", "difficulty": 2, "level": 4 },
    { "playStyle": "SINGLE", "difficulty": 3, "level": 5 },
    { "playStyle": "DOUBLE", "difficulty": 1, "level": 3 },
    { "playStyle": "DOUBLE", "difficulty": 2, "level": 5 },
    { "playStyle": "DOUBLE", "difficulty": 3, "level": 6 }
  ]
}
