{
  "slug": "dub-i-dub",
  "series": "2nd",
  "name": "DUB I DUB",
  "artist": "ME & MY",
  "bpm": 136,
  "charts": [
    { "playStyle": "SINGLE", "difficulty": 1, "level": 4 },
    { "playStyle": "SINGLE", "difficulty": 2, "level": 6 },
    { "playStyle": "SINGLE", "difficulty": 6, "level": 8 },
    { "playStyle": "DOUBLE", "difficulty": 1, "level": 5 },
    { "playStyle": "DOUBLE", "difficulty": 2, "level": 7 },
    { "playStyle": "COUPLE", "difficulty": 1, "level": 4 },
    { "playStyle": "COUPLE", "difficulty": 2, "level": 6 },
    { "playStyle": "COUPLE", "difficulty": 3, "level": 8 }
  ]
}
