{
  "slug": "dynamite-rave",
  "series": "konamix",
  "name": "DYNAMITE RAVE",
  "artist": "NAOKI",
  "bpm": 150,
  "charts": [
    { "playStyle": "SINGLE", "difficulty": 1, "level": 5 },
    { "playStyle": "SINGLE", "difficulty": 2, "level": 7 },
    { "playStyle": "SINGLE", "difficulty": 3, "level": 9 },
    { "playStyle": "DOUBLE", "difficulty": 1, "level": 5 },
    { "playStyle": "DOUBLE", "difficulty": 2, "level": 6 },
    { "playStyle": "DOUBLE", "difficulty": 4, "level": 8 },
    { "playStyle": "6-PANELS", "difficulty": 1, "level": 4 },
    { "playStyle": "6-PANELS", "difficulty": 2, "level": 7 },
    { "playStyle": "6-PANELS", "difficulty": 3, "level": 9 },
    { "playStyle": "BATTLE", "difficulty": 1, "level": 6 }
  ]
}
