{
  "slug": "afronova-primeval",
  "series": "konamix",
  "name": "AFRONOVA PRIMEVAL",
  "artist": "8 bit",
  "bpm": 200,
  "charts": [
    { "playStyle": "SINGLE", "difficulty": 1, "level": 4 },
    { "playStyle": "SINGLE", "difficulty": 2, "level": 6 },
    { "playStyle": "SINGLE", "difficulty": 3, "level": 9 },
    { "playStyle": "DOUBLE", "difficulty": 1, "level": 4 },
    { "playStyle": "DOUBLE", "difficulty": 2, "level": 6 },
    { "playStyle": "DOUBLE", "difficulty": 3, "level": 9 }
  ]
}
