{
  "slug": "groove",
  "series": "max2-us",
  "name": "Groove",
  "artist": "Sho-T feat. Brenda",
  "bpm": 130,
  "charts": [
    { "playStyle": "SINGLE", "difficulty": 0, "level": 1 },
    { "playStyle": "SINGLE", "difficulty": 1, "level": 4 },
    { "playStyle": "SINGLE", "difficulty": 2, "level": 6 },
    { "playStyle": "SINGLE", "difficulty": 3, "level": 8 },
    { "playStyle": "DOUBLE", "difficulty": 1, "level": 3 },
    { "playStyle": "DOUBLE", "difficulty": 2, "level": 6 },
    { "playStyle": "DOUBLE", "difficulty": 3, "level": 8 }
  ]
}
