{
  "slug": "exotic-ethnic",
  "series": "max-jp",
  "name": "exotic ethnic",
  "artist": "RevenG",
  "bpm": 190,
  "charts": [
    {
      "playStyle": "SINGLE",
      "difficulty": 1,
      "level": "?"
    },
    {
      "playStyle": "SINGLE",
      "difficulty": 2,
      "level": "?"
    },
    {
      "playStyle": "SINGLE",
      "difficulty": 3,
      "level": "?"
    },
    {
      "playStyle": "DOUBLE",
      "difficulty": 1,
      "level": "?"
    },
    {
      "playStyle": "DOUBLE",
      "difficulty": 2,
      "level": "?"
    },
    {
      "playStyle": "DOUBLE",
      "difficulty": 3,
      "level": "?"
    }
  ]
}
